{
  "action": "REQUEST_GITHUB_AI_REVIEW",
  "request_id": "req-review-2026-002",
  "plan_id": "plan-review-2026-002",
  "review_run_id": "review-run-002",
  "repository": {
    "owner": "example-team",
    "name": "account_service"
  },
  "pull_request_number": 7,
  "head_sha": "abcdef0123456789abcdef0123456789abcdef0123456789abcdef0123456789",
  "review_focus": ["SECURITY"]
}
